original_text,label,label_name,paraphrase,similarity
"Pro tours: The stops   the talk PGA Event: 84 Lumber Classic Site: Nemacolin Woodlands Resort  amp; Spa, Mystic Rock Course (7,276 yards, par 72), Farmington, Pa. Schedule: Today-Sunday. Purse: \$4.2 million. Winner's share: \$756,000. Television: ESPN (today, 3:30-6 p.m.; tomorrow, 3:50-6; Saturday, 3:30-5:30; Sunday, 3-6). Last year: J.L. Lewis closed with a course-record 62 for a two-stroke victory over Frank Lickliter, Stuart Appleby, and Tim Petrovic. ...",1,Sports,"The stops the talk PGA Event: 84 Lumber Classic Site: Nemacolin Woodlands Resort amp; Spa, Mystic Rock Course (7,276 yards, par 72), Farmington, Pa. Schedule: Today-Sunday. Purse: $4.2 million. Winner's share: $756,000. Television: ESPN (today, 3:30-6 p.m.; tomorrow, 3:50-6; Saturday 3:30-5:30; Sunday 3-6) Last year: J.L. Lewis",0.8785
"Rivals Try to Turn Tables on Charles Schwab By MICHAEL LIEDTKE     SAN FRANCISCO (AP) -- With its low prices and iconoclastic attitude, discount stock broker Charles Schwab Corp. (SCH) represented an annoying stone in Wall Street's wing-tipped shoes for decades...",3,Sci/Tech,"Rivals try to turn the tables on Charles Schwab By MICHAEL LIEDTKE SAN FRANCISCO (AP) -- With its low prices and iconoclastic attitude, the discount stock broker SCH (SCH) has been an annoying stone in the wing-tipped shoes of Wall Street for decades ...",0.9706
Life After Yasir Arafat His successors wanted an orderly funeral. They brought in bulldozers to clean up Yasir Arafat #39;s broken-down headquarters in Ramallah.,0,World,His successors wanted an orderly funeral and brought in bulldozers to clean up Yasir Arafat #39;s broken headquarters in Ramallah .,0.9197
"Fannie Mae Pays the Price of Cutting Corners to Look Safe Two regulatory agencies have concluded that Fannie Mae cut corners when it came to its accounting, and that has severely damaged its image.",2,Business,"Fannie Mae Pays the Price of Cutting Corners to Look Safe Two regulatory agencies have concluded that when it came to its accounting, Fannie mae cut corners and that has severely damaged its image .",0.9961
ATI launches new Radeon Xpress 200 chipsets for AMD K8 platform ATI Technologies today announced the availability of its new Radeon Xpress 200 series of core logic chipsets for the AMD K8 desktop platform.,3,Sci/Tech,ATI launches new Radeon Xpress 200 chipsets for the AMD K8 platform ATI Technologies today announced the availability of its new x-ray xpress 200 series of core logic chips for the K8 desktop platform .,0.9601
"Yukos bosses in exile, its survival in doubt Russian oil company Yukos, with shares near all-time lows and its bosses in exile, warned last night it is being driven toward bankruptcy.",2,Business,"Yukos bosses in exile, its survival in doubt Russian oil company Yukos, with shares near all-time lows and its boss in exil, warned it is being driven toward bankruptcy last night .",0.994
"Tennis: Canas crushes Novak to reach Shanghai final, faces &lt;b&gt;...&lt;/b&gt; SHANGHAI : Argentina #39;s Guillermo Canas dominated Jiri Novak of the Czech Republic to book his place in the final of the 380,000-dollar ATP Shanghai Open tennis tournament against unheralded German Lars Burgsmuller.",1,Sports,"Tennis: Canas crushes Novak to reach the Shanghai final , faces &lt;b&gt;...  SHANGHAI : Argentina #39 dominated Jiri Novak of the Czech Republic to book his place in the final of the 380,000-dollar ATP Shanghai Open tennis tournament against the unheralded German Lars Burgsmuller .",0.9683
Red Hat Buys Netscape Enterprise Suite Technologies Red Hat chairman and chief executive Matthew Szulik said in a statement:  quot;Directory Server and Certificate Management System have already been widely deployed in the enterprise and are mature ,3,Sci/Tech,Red Hat buys Netscape Enterprise Suite Technologies Red Hat Chairman and Chief Executive Matthew Szulik said in a statement: quot;Directory Server and Certificate Management System have already been widely deployed in the enterprise and are mature .,0.9948
"George: Loss evicts Marlins #39; playoff hopes MIAMI GARDENS - Monday was supposed to be moving day for the Florida Marlins, a playoff contender already marked extremely fragile.",1,Sports,"George: Loss evicts Marlins #39; playoff hopes MIAMI GARDENS - Monday was supposed to be moving day for the Florida Marliners , a playoff contender already marked extremely fragile .",0.9762
"More gold for Britain as Wiggins strikes Bradley Wiggins has given Britain their second Olympic cycling gold medal in two days, winning the men #39;s 4-km individual pursuit.",1,Sports,"Bradley Wiggins has given Britain their second Olympic cycling gold medal in two days, winning the men #39;s 4-km individual pursuit .",0.9165
"Florida weather may help Israeli citrus industry As sunshine state licks its wounds from Hurricane Frances, Gan Shmuel could reap the benefits. The most important news for Florida #39;s 2.8 million residents this week has not been from the Republican ",2,Business,"The Florida weather may help the Israeli citrus industry As the sunshine state licks its wounds from Hurricane Frances, Gan Shmuel could reap the benefits. The most important news for Florida #39;s 2.8 million residents this week has not been from the Republican Party",0.9846
"Two Millwall fans stabbed, hospitalized BUDAPEST, Hungary -- UEFA has charged Hungary #39;s Ferencvaros after their fans threw missiles and shouted racist abuse in Thursday #39;s UEFA Cup tie against Millwall.",1,Sports,"Two Millwall fans stabbed, hospitalized BUDAPEST, Hungary -- UEFA has charged Hungary #39;s Ferencvaros after their fans threw missiles and shouted racist abuse in Thursday #39's match against Millwall .",0.993
"Users Buoyed by Monthly Patch Releases OCTOBER 18, 2004 (COMPUTERWORLD) - Microsoft Corp. #39;s move to a monthly patch-release cycle one year ago this month has made it easier to install security updates for Windows and other products, IT managers said last weekeven as they were greeted with a ",3,Sci/Tech,"Users Buoyed by Monthly Patch Releases OCTOBER 18, 2004 (COMPUTERWORLD) - Microsoft Corp. #39;s move to a monthly patch release cycle a year ago this month has made it easier to install security updates for Windows and other products, IT managers said last week as they were greeted with a patch release .",0.9775
"Video Games Used to Relax Kids in Hospital (AP) AP - Letting children play video games on a Game Boy in the operating room before undergoing surgery can help relax them better than tranquilizers or holding Mommy's hand, researchers say.",3,Sci/Tech,Video Games Used to Relax Kids in Hospital (AP) AP - Letting children play video games on a Game Boy in the operating room before surgery can help relax them better than tranquilizers or holding Mommy's hand .,0.9912
"Mark Cuban prompts dot-com redux reporteri #39;s notebook SAN FRANCISCO--Hope and cynicism sparred to a draw on Tuesday at the glitzy opening banquet of Web 2.0 conference here, as serial entrepreneur and reality TV show host Mark Cuban took the stage to talk about what #39;s next for the 10-year ",3,Sci/Tech,"Mark Cuban prompts dot-com redux reporteri #39;s notebook SAN FRANCISCO--Hope and cynicism sparred on Tuesday at the glitzy opening banquet of the Web 2.0 conference here, as serial entrepreneur and reality TV show host mark Cuban took the stage to talk about what is next for the 10-year period .",0.9633
"Automakers sue California over emissions FRESNO, Calif. -- Automobile manufacturers sued on Tuesday to block the world #39;s toughest vehicle emissions standards, adopted by California regulators in September to cut greenhouse gases.",2,Business,"Automakers sue California over emissions FRESNO, Calif. -- Automobile manufacturers sued on Tuesday to block the world's toughest vehicle emissions standards, adopted by California regulators in September to reduce greenhouse gases .",0.979
"IBM To Amp Integration with Venetica Buy (NewsFactor) NewsFactor - IBM (NYSE: IBM) has said it will purchase Venetica, a privately held firm that provides content-integration software to unstructured data sources.",3,Sci/Tech,"IBM To Amp Integration with Venetica Buy (NewsFactor) Newsfactor - IBM (NYSE: IBM) has announced that it will buy venetica, a privately held firm that provides content integration software to unstructured data sources .",0.9972
"US rate rise locked in for Wednesday (AFP) AFP - The unexpected boom in US job creation in October has locked in an interest rate rise and will likely encourage another tightening in December, analysts said.",2,Business,"US rate rise locked in for Wednesday (AFP) AFP - The unexpected boom in US job creation in October has locked in an interest rate rise and will likely encourage another tightening in December, analysts said .",1.0
"Israeli tank kills three Egyptian troops An Israeli tank has opened fire and killed three Egyptian troops in a border zone near the Gaza Strip after mistaking them for Palestinian arms smugglers, Israeli security sources say.",0,World,"Israeli tank kills three Egyptian troops An Israeli tank opened fire and killed three Egyptian soldiers in a border zone near the Gaza Strip after mistaking them for Palestinian arms smugglers, Israeli security sources say .",0.9919
"Appeals court faults Oracle in shareholder suit Judges send case back to lower court to sort out allegations of improper bookkeeping and ""suspicious"" stock sales.",3,Sci/Tech,Appeals court faults Oracle in shareholder suit Judges send case back to lower court to sort out allegations of improper bookkeeping and suspicious stock sales .,0.9928
"UPDATE 2-TD, Banknorth in talks on possible deal Toronto Dominion Bank (TD.TO: Quote, Profile, Research) said on Wednesday that it is in talks with US-based Banknorth Group (BNK.N: Quote, Profile, Research) about a possible deal, in line with the Canadian bank #39;s push for ",2,Business,"UPDATE 2-TD, Banknorth in talks on a possible deal with the Toronto Dominion Bank (TD.TO: Quote, Profile, Research) said on Wednesday that it is in talks with the US-based bank N.B.K. (BNK.N: quote, profile, research) about a potential deal, in line with the Canadian bank #39;s push for a deal .",0.9505
"Lloyds TSB to Move More Than 1,000 UK Jobs to Asia (Update1) Lloyds TSB Group Plc, the UK #39;s No. 5 bank by assets, plans to move at least another 1,000 employees from Britain to Asia, where labor costs are lower.",2,Business,"Lloyds TSB to move more than 1,000 UK jobs to Asia (Update1) Lloyds Tsb Group Plc, the UK No. 5 bank by assets, plans to move at least another 1,000 employees from Britain to Asia, where labor costs are lower .",0.9918
Cordero sets new club mark com. Cordero notched his 44th save of the season Sunday to establish a Rangers record previously held by current Rangers roving pitching instructor John Wetteland.,1,Sports,"Cordero sets new club mark com. On Sunday , cordero notched his 44th save of the season to establish a Rangers record previously held by current Rangers roving pitching instructor John Wetteland .",0.9937
Poll: I was right to let Henry score Referee Graham Poll has insisted that he acted within the laws of the game when he allowed Thierry Henry to take a quick free-kick yesterday.,1,Sports,I was right to let Henry score Referee Graham Poll has insisted that he acted within the laws of the game when he allowed Thierry Henry to take a quick free-kick yesterday .,0.9848
"Fannie Mae woes may hit stock If Fannie Mae (FNM) is hampered by new limits on its operations, shareholders of the USA #39;s biggest mortgage-investment company are likely to feel the pinch more than the nation #39;s mortgage borrowers.",2,Business,"If Fannie Mae (FNM) is hampered by new limits on its operations, shareholders of the largest mortgage investment company in the USA are likely to feel the pinch more than the mortgage borrowers of the nation #39 .",0.8824
"US suspends helicopter flights after Japan crash (AFP) AFP - The United States suspended flights of CH-53D military helicopters in Japan, bowing to protests over a crash in an Okinawa university campus.",0,World,"US suspends helicopter flights after Japan crash (AFP) AFP - The United States suspended flights of CH-53D military helicopters in Japan, bowing to protests over a crash on an Okinawa University campus .",0.9999
"NFL games on TV NY JETS (6-1) at BUFFALO (2-5) When, where: Sunday, 1 p.m., at Orchard Park, N.Y. TV: Ch. 4. Last meeting: New York won, 16-14, Oct. 10. Comments: The Jets pulled out the first meeting, 16-14, on a late 38-yard Doug Brien field goal. Chad Pennington threw for a season high 310 yards in that game, 90 of which went to ...",1,Sports,"NFL games on TV NY JETS (6-1) at BUFFALO (2-5) When, where: Sunday, 1 p.m., at Orchard Park, N.Y. TV: Ch. 4. Comments: The Jets won the first meeting, 16-14, on a late 38-yard Doug Brien field goal . Chad Pennington threw for a season high 310 yards in that game , 90 of which went to ...",0.9903
"GM May Close Plant in Europe  DETROIT (Reuters) - General Motors Corp. &lt;A HREF=""http://www.investor.reuters.com/FullQuote.aspx?ticker=GM.N target=/stocks/quickinfo/fullquote""&gt;GM.N&lt;/A&gt; will likely  cut some jobs in Europe and may close a plant there as part of  a restructuring plan under development to try to return the  region to profitability, the U.S. automaker said on Wednesday.",2,Business,"GM may close a plant in Europe DETROIT (Reuters) - General Motors Corp. &lt;A HREF=""http://www.investor.reuters.com/FullQuote.aspx?ticker=GM.N target=/stocks/quickinfo/fullquote""&gt;GM.n 's a restructuring plan under development to try to return the region to profitability , the U.S. automaker said on",0.9628
"Court Declines to Hear Gay Marriage Case (AP) AP - The Supreme Court on Monday sidestepped a dispute over gay marriages, rejecting a challenge to the nation's only law sanctioning such unions.",0,World,"Court declines to hear gay marriage case (AP) AP - The Supreme Court on Monday sidestepped a dispute over gay marriages, rejecting a challenge to the nation's only law sanctioning such unions .",1.0
"Israel would not bar Arafat return after overseas treatment JERUSALEM, Oct 28 (AFP) - Israel will not bar ailing Palestinian leader Yasser Arafat from returning to the West Bank if he were to leave for medical treatment, senior government spokesman Raanan Gissin told AFP Thursday.",0,World,"Israel would not bar Arafat from returning to the West Bank after overseas treatment JERUSALEM, Oct. 28 (AFP) - Israel will not bar the ailing Palestinian leader Yasser arafat returning to Gaza if he were to leave for medical treatment , senior government spokesman Raanan Gissin told AFP Thursday .",0.981
"BT to buy Infonet for US\$965mil BERLIN: BT Group Plc, Britain #39;s largest phone company, plans to buy Infonet Services Corp. for US\$965mil to add a data network spanning more than 180 countries.",2,Business,"BT to buy Infonet for US$965mil BERLIN: BT Group Plc, Britain#39;s largest phone company, plans to purchase Infonet Services Corp. for US $965 million to add a data network spanning more than 180 countries .",0.9854
"CBS Realigns Entertainment Divisions eslie Moonves, the co-president of Viacom, yesterday realigned the management of the company #39;s CBS entertainment division and Paramount television production studio, promising smoother and greater interaction between the two.",2,Business,"CBS Realigns Entertainment Divisions eslie Moonves, co-president of Viacom, yesterday realigned the management of the company #39;s entertainment division and Paramount television production studio, promising smoother and greater interaction between the two .",0.995
Do-not-call bill could be introduced today The federal government hopes to introduce legislation today to establish a do-not-call registry for consumers who want to stop endless telemarketing pitches.,2,Business,Do-not-call bill could be introduced today The federal government hopes to introduce legislation today to establish a do not-call registry for consumers who want to stop endless telemarketing pitches .,0.9984
"Deportivo La Corua 0-1 Liverpool: FT Report LA CORUNA, November 3 (Champions League) - Rafael Benitez heard his name ring around a Spanish stadium in his homeland again but this time it was from Scouse voices rather than those in Valencia, with whom he won La Liga.",1,Sports,"Deportivo La Corua 0-1 Liverpool: FT Report LA CORUNA, 3 November (Champions League) - Rafael Benitez heard his name again ring around a Spanish stadium in his homeland, but this time it was from Scouse voices rather than those in Valencia, with whom he won La Liga .",0.9931
"NHL Owner Is Criticized for Talking of Replacement Players The day before the regular season was supposed to open, the National Hockey League rebuked a team official yesterday for his comments about the league #39;s strategy in its labor lockout, its second in a decade.",1,Sports,"The NHL owner is criticised for talking about replacement players The day before the regular season was supposed to open, the National Hockey League rebuked a team official yesterday for his comments about the league #39;s strategy in its labor lockout, its second in a decade .",0.9846
"Pfizer to Sponsor Large New Celebrex Trial  NEW YORK (Reuters) - Pfizer Inc. said on Monday it plans to  sponsor a major clinical study to further assess the  cardiovascular safety of its arthritis drug Celebrex following  the withdrawal of Merck   Co.'s Vioxx, a drug in the same  class.",2,Business,"Pfizer to sponsor a large new Celebrex trial NEW YORK (Reuters) - On Monday, after the withdrawal of Merck Co. 's Vioxx, a drug in the same class , pfizer Inc. said it plans to support a major clinical study to assess the cardiovascular safety of its arthritis drug Celebrex .",0.9868
"Amazon to Buy Chinese Retailer Joyo.com Internet retailer Amazon.com Inc. said on Thursday that it will buy Joyo.com Ltd., which runs some of China #39;s biggest retail Web sites, for about \$75 million to gain entry into China #39;s fast-growing market.",3,Sci/Tech,"Amazon to buy the Chinese retailer Joyo.com Internet retailer Amazon.com Inc. said on Thursday that it will buy for about 75 million Joyo .com Ltd., which runs some of China 's biggest retail Web sites , to gain entry into the fast-growing market of China #39 .",0.9782
"US Forces Bomb Iraq's Falluja, Seize Zarqawi Aide (Reuters) Reuters - U.S. planes bombed targets in\Iraq's rebel-held city of Falluja, killing two people, and the\U.S. military said it had captured a lieutenant of its\deadliest Islamist enemy in Iraq in a raid early on Saturday.",0,World,"US forces bomb Iraq's Falluja, seize Zarqawi Aide (Reuters) Reuters - U.S. planes bombed targets in the rebel-held city of Fallusa in Iraq, killing two people, and the US military said it had captured a lieutenant of its deadliest Islamist enemy in Iraq in a raid on Saturday .",0.9771
Cricket: Dubai global academy The International Cricket Council are to open a global cricket academy designed to improve standards of lesser nations.,0,World,Cricket: Dubai Global Academy The International Cricket Council are to open a global cricket academy designed to improve the standards of lesser nations .,0.9997
"Pay Adviser Talks of Role in Ovitz Deal The outside adviser who helped draft the 1995 employment agreement for the president of Walt Disney, Michael S. Ovitz, testified on Tuesday that he had reservations ",2,Business,"Pay Adviser talks about role in Ovitz Deal The outside adviser who helped draft the 1995 employment agreement for the president of Walt Disney, Michael S.Ovitz, testified on Tuesday that he had reservations .",0.9829
"Xandros rolls out Linux desktop management app Linux desktop vendor Xandros Inc. on Tuesday announced the availability of its new Xandros Desktop Management Server (xDMS) application, which gives IT administrators the tools to roll out, configure and maintain mass deployments of Linux-equipped PCs.",3,Sci/Tech,"Xandros rolls out Linux desktop management app Linux desktop vendor xandros Inc. announced on Tuesday the availability of its new XANDros Desktop Management Server (xDMS) application, which gives IT administrators the tools to roll out, configure and maintain mass deployments of Linux-equipped PCs .",0.9989
"French Hostage Transfer Sparks Release Hopes  PARIS (Reuters) - Hopes of a swift end to the French  hostage crisis rose early Friday, after the Le Figaro newspaper  that employs one of the two captives said the men were now  being held by Iraqi guerrillas willing to negotiate their  release.",0,World,French Hostage Transfer Sparks Release Hopes PARIS (Reuters) - Hopes of a swift end to the French hostage crisis rose early Friday after the Le Figaro newspaper that employs one of the two captives said that the men were now held by Iraqi guerrillas willing to negotiate their release .,0.9987
"Apple Confirms More UK Retail Stores Coming; Additional Locations &lt;b&gt;...&lt;/b&gt; Apple Computer confirmed Thursday it plans to open two additional Apple retail stores in the United Kingdom in 2005 - one in Birmingham, northwest ",3,Sci/Tech,"Apple confirms more UK retail stores coming; additional locations &lt;b&gt;... Apple Computer confirmed Thursday that it plans to open two additional Apple retail stores in the United Kingdom in 2005 - one in Birmingham, northwest",0.9934
"Get the Facts on Microsoft Benchmarks Now that Steve Ballmer and company have given you all the facts you need to compare Windows and Linux, allow me to add just one little tidbit.",3,Sci/Tech,"Get the facts on Microsoft Benchmarks Now that Steve Ballmer and company have given you all the facts you need to compare Windows and Linux, allow me to add just one little tidbit.",1.0
Bulls Stomp Cavaliers Eddy Curry scores 20 points and rookie Ben Gordon adds 21 to lead Chicago to a rare 113-85 lopsided win over Cleveland on Wednesday.,1,Sports,Bulls Stomp Cavaliers Eddy Curry scores 20 points and rookie Ben Gordon adds 21 to lead Chicago to a rare 113-85 lopsided win over Cleveland on Wednesday .,1.0
Recording Industry Sues 750 Computer Users LOS ANGELES - The recording industry on Thursday filed another round of copyright infringement lawsuits against people it said were illegally distributing songs over the Internet.,3,Sci/Tech,Recording Industry Sues 750 Computer Users LOS ANGELES - The recording industry filed another round of copyright infringement lawsuits against people it said were illegally distributing songs over the Internet .,0.993
"Bush Urges Putin Uphold Russian Democracy (Reuters) Reuters - President Bush on Wednesday urged\Russian President Vladimir Putin to ""uphold the principles of\democracy"" in a carefully worded message expressing concern\about Putin's proposed political reforms.",0,World,"Bush urges Putin to uphold Russian democracy (Reuters) Reuters - President Bush on Wednesday urged Russian President Vladimir Putin to ""uphold the principles of democracy"" in a carefully worded message expressing concern about Putin's proposed political reforms .",0.9839
"2 charged after Chicago area pals are slain in NC tragedy Ever since they met in fourth grade, Brett Johnson Harman and Kevin McCann were as close as brothers.  quot;They had the same mannerisms, the same kind of humor, and they even looked alike, quot; said McCann #39;s father, Dennis McCann.",1,Sports,"2 charged after Chicago area pals are slain in the NC tragedy Ever since they met in the fourth grade, Brett Johnson Harman and Kevin McCann were as close as brothers . quot;They had the same mannerisms, the same kind of humor , and they even looked alike , '' said the father of MCann #39 .",0.9513
"Warrick doubtful for Sunday Cincinnati, OH (Sports Network) - Cincinnati Bengals wide receiver Peter Warrick is doubtful for Sunday #39;s game against Cleveland because of a shin injury.",1,Sports,"Warrick doubtful for Sunday Cincinnati, OH (Sports Network) - Cincinnati Bengals wide receiver Peter Warrick is doubtful to play Sunday #39 against Cleveland because of a shin injury .",0.9919
"Pacific Oil Link Is Best for Russia, Ambassador Says (Update1) Russia, the world #39;s second-biggest oil exporter, will benefit most from a Siberian crude oil pipeline to the Pacific rather than to China as energy resources are needed to develop the ",2,Business,"The Pacific Oil Link Is Best for Russia, Ambassador Says (Update1) Russia, the second largest oil exporter in the world, will most benefit from a Siberian crude oil pipeline to the Pacific rather than to China as energy resources are needed to develop the region .",0.9808
"Vonage Calls on Linksys for VoIP (PC World) PC World - Linksys will provide broadband-to-phone adapters and, eventually, Wi-Fi equipment.",3,Sci/Tech,Vonage calls Linksys for VoIP (PC World) PC World - Linksy will provide broadband-to-phone adapters and eventually Wi-Fi equipment .,0.9721
"McCain again opposes the president Global warming needs more attention, according to John McCain, and President Bush needs to lead the way. I listened to some of the hearings on this subject this week, and I must say the people testifying are ",3,Sci/Tech,"McCain again opposes the president Global warming needs more attention, according to John McCain, and President Bush needs to lead the way . I listened to some of the hearings on this subject this week and I must say that the people testifying are .",0.9927
