original_text,label,label_name,paraphrase,similarity
"Sloppy win suits Badgers TUCSON -- Booker Stanley ran for a career-high 135 yards on 30 carries, including a 7-yard run for Wisconsin's only touchdown, and the 20th-ranked Badgers rallied for a stormy 9-7 victory over Arizona yesterday.",1,Sports,"Sloppy win suits Badgers TUCSON -- Booker Stanley ran for a career-high 135 yards on 30 carries, including a 7-yard run for Wisconsin's only touchdown , and the 20th-ranked badgers rallied yesterday to a stormy 9-7 victory over Arizona .",0.9994
"U.S. Treasuries Inch Up, Await Data  LONDON (Reuters) - U.S. Treasury prices inched higher on  Friday, with a rally in Japanese government bond (JGB) prices  helping the market recover some ground from the previous day's  sell-off.",2,Business,"U.S. Treasury prices inched higher on Friday, with a rally in Japanese government bonds (JGB) prices helping the market recover some ground from the sell-off the previous day .",0.8772
"Alcoa Shares Fall Most Since April in Europe After Forecast Shares of Alcoa Inc., the world #39;s biggest aluminum producer, fell the most in almost five months in Europe after the company said third-quarter profit from continuing operations will be below analysts #39; estimates.",2,Business,"Shares of Alcoa Inc., the world#39;s largest aluminum producer, fell the most in Europe since April after the company said that the third-quarter profit from continuing operations will be below analysts' estimates .",0.9489
Afghanistan Official Bashardost Resigns (AP) AP - An Afghan Cabinet minister resigned Monday after President Hamid Karzai rejected his drive to shut down relief groups he accused of wasting money on expensive cars and houses.,0,World,Afghanistan official Bashardost resigns (AP) AP - An Afghan cabinet minister resigned Monday after President Hamid Karzai rejected his drive to shut down relief groups he accused of wasting money on expensive cars and houses .,1.0
"Immigrants settled in big cities, but less likely to find work: StatsCan (Canadian Press) Canadian Press - OTTAWA (CP) - Most of the nearly two million immigrants who arrived in Canada during the 1990s settled in one of the country's 27 census metropolitan areas, but still found it harder to find work than natural-born citizens, Statistics Canada reported Wednesday.",0,World,"Immigrants settled in big cities, but less likely to find work: StatsCan (Canadian Press) Canadian Press - OTTAWA (CP) - Most of the nearly two million immigrants who arrived in Canada during the 1990s settled into one of the 27 census metropolitan areas of the country, but still found it harder to find employment than natural-born citizens, reported Statistics Canada Wednesday .",0.9929
"Nowitzki, Mavericks Snap Timberwolves #39; Streak Dirk Nowitzki scored 23 of his 34 points in the second half as the Dallas Mavericks snapped the Minnesota Timberwolves #39; five-game winning streak 97-87.",1,Sports,"Nowitzki, Mavericks snap Timberwolves #39 - Streak Dirk Nowitzk scored 23 of his 34 points in the second half as the Dallas Mavs snapped the Minnesota Timberwolves - Five-game winning streak 97-87 .",0.9853
"Product Previews palmOneUpgrades Treo With Faster Chip, Better Display\With more than 600,000 units shipped, the Treo 600 is one of the big smartphone success stories. Last week, palmOne introduced the follow-on Treo 650 with a higher resolution 320-by-320-pixel TFT screen, which the company claims increases the visible area of the display and makes pictures and documents much clearer. The 650 also carries a removable battery; 32MB of flash memory, and a faster 312MHz, Intel XScale processor. Improved multimedia features include a built-in MP3 player, a digital camera with improved low-light capabilities, as well as video capture and playback functionality. Products are expected to ship by years end from some carriers who will add their own services, and will be priced at about \$499.\ Treo 650, palmOne",2,Business,"PalmOne Upgrades Treo With Faster Chip, Better DisplayWith more than 600,000 units shipped, the Treo 600 is one of the biggest smartphone success stories . The 650 also carries a removable battery, 32MB of flash memory and a faster 312MHz Intel XScale processor . Improved multimedia features include a built-in MP3 player, as well as video capture and playback functionality . Products are expected to ship from some carriers who will add their own services by year end and",0.9175
"Researchers Study Plastics From Feathers (AP) AP - Researchers at Iowa State University are pecking away at ways of making environmentally friendly plastic. From golf tees to a biodegradable flower pot that can be planted directly in the ground, scientists are studying ways of making plastics from things such as chicken feathers and soy protein.",3,Sci/Tech,"Researchers study plastics from feathers (AP) AP researchers at Iowa State University are pecking away at ways of making environmentally friendly plastics : from golf tees to a biodegradable flower pot that can be planted directly in the ground , scientists are studying ways to make plastic from things such as chicken feathers and soy protein .",0.9917
Microsoft signs two Indian deals The announcement came as Microsoft chief executive Steve Ballmer opened the group #39;s new Indian headquarters in the city of Hyderabad.,2,Business,Microsoft signs two Indian deals The announcement came as Microsoft chief executive Steve Ballmer opened the new Indian headquarters of the group in the city of Hyderabad .,0.9728
"Stocks Sink on Coke's Gloomy Forecast NEW YORK - Stocks headed lower Wednesday after beverage giant Coca-Cola Co. issued a gloomy forecast, and a lower-than-expected reading on industrial production for August threw the nation's broader economic outlook into question...",0,World,Stocks sink on Coke's gloomy forecast NEW YORK - Stocks headed lower Wednesday after beverage giant Coca-Cola Co. issued a dreadful forecast and a lower-than-expected reading on industrial production for August threw the nation's overall economic outlook into question ...,0.9828
"Study: Wrecks Jump 3 Days After Terrorism Fatal traffic accidents increase sharply in Israel on the third day after a terrorist attack, and researchers are searching for an explanation why.",3,Sci/Tech,"Study: Wrecks jump 3 days after terrorist attacks Fatal traffic accidents increase sharply in Israel on the third day after a terrorist attack , and researchers are searching for an explanation why .",0.9926
"Steel group sees continued strength in China demand LONDON (CBS.MW) -- European markets saw a moderate advance in early trade Monday, carrying over some of the late-session rally on Wall Street and helped by steel group Arcelor #39;s view of Chinese demand.",2,Business,"Steel group sees continued strength in China demand LONDON (CBS.MW) -- European markets saw a moderate advance in early trade Monday, carrying some of the late-session rally on Wall Street and helped by steel group Arcelor #39;s view of Chinese demand .",0.9995
"Wenger commits future to Arsenal Arsenal FC have agreed a three-year contract extension with manager Arsne Wenger, retaining the Frenchman #39;s services until May 2008.",1,Sports,"Wenger commits to Arsenal Arsenal FC have agreed a three-year contract extension with manager Arsne Wenger, retaining the Frenchman #39;s services until May 2008 .",0.968
Japan Shares Down 1.6 Pct  TOKYO (Reuters) - Tokyo's Nikkei average dropped 1.65  percent by mid-afternoon on Friday and was on course for a  sixth day of losses as worries over high oil prices and  uncertainty over the U.S. economic and market outlook hit a  broad range of stocks.,2,Business,Japan shares down 1.6 pct TOKYO (Reuters) - Tokyo's Nikkei average dropped 1.65 percent on Friday and was on course for a sixth day of losses as worries over high oil prices and uncertainty over the U.S. economic and market outlook hit a broad range of stocks .,0.999
"General Mills goes whole grains NEW YORK (CNN/Money) - General Mills announced plans Thursday to start using healthier whole grains in all of its ready-to-eat cereals, including children #39;s cereals such as Trix, Cocoa Puffs and Lucky Charms.",2,Business,"General Mills goes whole grains NEW YORK (CNN/Money) - General Mill announced Thursday plans to use healthier whole grains in all its ready-to-eat cereals, including children's cereals such as Trix, Cocoa Puffs and Lucky Charms .",0.9831
"UK broadband usage doubles in past six months New research from NOP, shows that more of the UK Internet population are progressing to broadband - with usage at 41 per cent up from 27 per cent just six months ago, and an increase in females using the internet.",3,Sci/Tech,UK broadband usage doubles in the past six months New research from NOP shows that more of the UK Internet population is moving to broadband - with usage at 41 per cent up from 27 per cent six months ago and an increase in females using the internet .,0.9827
Shares of Large Drug Makers Fall  NEW YORK (Reuters) - Shares of large drug makers fell on  Thursday after a top U.S. cardiologist questioned the safety of  new arthritis drugs and the performance of U.S. regulators in  monitoring drug safety.,2,Business,Shares of Large Drug Makers fall NEW YORK (Reuters) - The shares of large drug makers fell on Thursday after a top US cardiologist questioned the safety of new arthritis drugs and the performance of U.S. regulators in monitoring drug safety .,0.997
Premier League charges Villa manager with illegal approach for &lt;b&gt;...&lt;/b&gt; The Premier League has charged Aston Villa manager David O #39;Leary with making an illegal approach for Southampton striker James Beattie.,1,Sports,Premier League charges Villa manager with an illegal approach for &lt;b&gt;... The Premier League has charged Aston Villa manager David O #39;Leary with making an unlawful approach for Southampton striker James Beattie .,0.9782
"Skybox updates risk management wares BOSTON - New software from Skybox Security will help companies monitor their networks and comply with U.S. federal and state data security regulations, and even help them prepare networks for dangerous new Internet worms, according to the company.",3,Sci/Tech,"Skybox updates risk management wares BOSTON - New software from Skybox Security will help companies monitor their networks and comply with U.S. federal and state data security regulations and even help them prepare networks for dangerous new Internet worms, according to the company .",0.9998
"Barcelona return for Mourinho Jose Mourinho, the Chelsea manager, last night talked about how  quot;emotional quot; it will be returning to Barcelona in the last 16, knockout stage of the Champions League.",1,Sports,"Last night , Jose Mourinho, the Chelsea manager , talked about how emotional it will be returning to Barcelona in the last 16 of the Champions League knockout stage .",0.9334
Anti-Doping Agency Is Boosted By Ban of Sprinter in Balco Case The United States Anti-Doping Agency received an important validation yesterday in its attempt to punish athletes who were suspected of doping in the Balco steroids scandal but who had not failed a drug test.,1,Sports,The anti-doping agency is boosted by the ban of the sprinter in the Balco case The United States Anti-Doping Agency received an important validation yesterday in its attempt to punish athletes suspected of doping in Balco steroids scandal but who had not failed a drug test .,0.9737
"Huskies fail 1st road test This so-called rivalry might be worth saving after all. UMass finally got one Thursday night. And the Minutemen did it in exciting fashion, one that totally disgusted Jim Calhoun.",1,Sports,Huskies fail 1st road test This so-called rivalry might be worth saving after all. UMass finally got one Thursday night and the Minutemen did it in an exciting fashion that totally disgusted Jim Calhoun .,0.9973
"Cards all hearts Ten outs away from winter, knowing a 105-win magic-carpet ride was about to hit the runway way too soon. Ten outs away from winter, and the St.",1,Sports,"Cards all hearts Ten outs away from winter, knowing that a 105-win magic carpet ride was about to hit the runway way too soon.",0.9505
"Google Founders Interviewed by Barbara Walters Google Founders Interviewed by Barbara Walters\\Google's founders, Larry Page and Sergey Brin, were interviewed last night by Barbara Walters on ABC's 20/20 10 Most Fascinating People. Andy Beal who doesn't seem to be too fond of Barbara Wawa pointed this out on his SearchEngineLowdown blog. I was too busy eating ...",3,Sci/Tech,Google Founders interviewed by Barbara WaltersGoogle founders Larry Page and Sergey Brin were interviewed on ABC's 20/20 10 Most Fascinating People last night . Andy Beal who doesn't seem to be too fond of Barbara Wawa pointed this out on his SearchEngineLowdown blog .,0.9581
Inzamam happy with win Captain Inzamam-ul-Haq praised his spinners after Pakistan knocked Kenya out of the Champions Trophy with a seven-wicket win at Edgbaston.,1,Sports,Captain Inzamam-ul-Haq praised his spinners after Pakistan knocked Kenya out of the Champions Trophy with a seven-wicket win at Edgbaston .,0.9187
"India #39;s Offer for Peace Talks on Kashmir Is Sweetened With Aid India #39;s prime minister, Manmohan Singh, came to Kashmir on Wednesday offering unconditional talks with anyone willing to renounce violence and a \$5.3 billion economic ",0,World,India #39;s offer for peace talks on Kashmir is sweetened with aid India # 39;s prime minister Manmohan Singh came to Kashmir on Wednesday and offered unconditional talks with anyone willing to renounce violence and a $5.3 billion economic deal .,0.9862
IU researchers helping to study video game-violence link Researchers from the Indiana University School of Medicine are trying to determine whether violent video games such as Grand Theft Auto can make players more prone to violent behavior.,3,Sci/Tech,Researchers from IU helping to study video game violence link Researchers from the Indiana University School of Medicine are trying to determine whether violent video games such as Grand Theft Auto can make players more prone to violent behavior .,0.9842
New I.B.M. Report Will Warn of Computer Security Threats I.B.M. plans to begin releasing a monthly report of threats to computer networks in an effort to establish an indicator similar to the federal governments Homeland Security Advisory System.,3,Sci/Tech,A new I.B.M. report will warn of computer security threats I. B. M. plans to release a monthly report of threats to computer networks in an effort to establish an indicator similar to the federal Homeland Security Advisory System .,0.9937
"Vietnam Opens Bunker Used by Ho Chi Minh (AP) AP - Behind thick concrete walls and iron doors, Ho Chi Minh and other top Vietnamese leaders hid in secret underground tunnels during U.S. B-52 bombing raids to plot key military strategies that led to America's defeat in the Vietnam War.",0,World,"Vietnam opens Bunker used by Ho Chi Minh (AP) AP - Behind thick concrete walls and iron doors, Ho Chi minh and other top Vietnamese leaders hid in secret underground tunnels during U.S. B-52 bombing raids to plot key military strategies that led to America's defeat in the Vietnam War .",1.0
"U.S. Forces Kill 50 Sadr Militia in Baghdad Suburb  BAGHDAD (Reuters) - U.S. forces killed more than 50 Shi'ite  militiamen on Wednesday in a significant advance into a Baghdad  suburb that is a powerbase for radical cleric Moqtada al-Sadr,  the military said.",0,World,"U.S. forces kill 50 Sadr militiamen in Baghdad suburb BAGHDAD (Reuters) - On Wednesday, US forces killed more than 50 Shi'ite militiamen , in a significant advance into a suburb of the city that is a power base for radical cleric Moqtada al-Sadr , the military said .",0.9909
"Thousands Hit NYC Streets; Cheney Arrives NEW YORK - Tens of thousands of demonstrators marched past the Madison Square Garden site of the Republican National Convention on Sunday, chanting, blowing whistles and carrying anti-war banners as delegates gathered to nominate President Bush for a second term.    On the eve of the convention, the demonstrators packed the street from sidewalk to sidewalk for 20 blocks as they slowly filed past...",0,World,"Thousands Hit NYC Streets; Cheney Arrives NEW YORK - Tens of thousands of demonstrators marched past the Madison Square Garden site of the Republican National Convention on Sunday, chanting, blowing whistles and carrying anti-war banners as delegates gathered to nominate President Bush for a second term . On the eve of the convention, the demonstrators packed the street from sidewalk to sidewalk for 20 blocks as they slowly filed past...",1.0
"Bosox strike deal with Mirabelli; Yanks, Flaherty close The Boston Red Sox have signed backup catcher Doug Mirabelli to a two-year deal worth \$3 million, making him the first of the World Series champions #39; 16 free agents to re-sign.",1,Sports,"The Boston Red Sox have signed backup catcher Doug Mirabelli to a two-year deal worth 3 million dollars, making him the first of the World Series champions #39; 16 free agents to resign .",0.8735
Honda aiming for BAR buyout? Motorsport.com. Reports this week suggest that Honda is aiming to either buy BAR or become co-owner of the team by purchasing a shareholding.,1,Sports,Honda aiming for BAR buyout? Motorsport.com. Reports this week suggest that Honda is either aiming to buy BAR or become co-owner of the team by purchasing a shareholding .,0.9977
"Mother of Jackson Accuser Testifies SANTA MARIA, Calif. - The mother of the boy accusing Michael Jackson of molestation testified Friday she does not remember a private investigator telling her that he was working for one of the pop star's attorneys, but believed he worked directly for the singer...",0,World,"Mother of Jackson Accuser Testifies SANTA MARIA, Calif. - The mother of the boy who accused Michael Jackson of molestation testified Friday that she does not remember a private investigator telling her that he was working for one of the pop star's attorneys, but believed he worked directly for the singer...",0.9975
"Hamm flap, Dream Team just wrong ATHENS, Greece -- Look at it this way: At least the US basketball team won #39;t be asked to give back its gold medal. On a day that was Olympic in scope both for its shock value and its intrinsic weirdness, the ",1,Sports,"Hamm, Dream Team just wrong ATHENS, Greece -- Look at it this way: At least the US basketball team won't be asked to give back its gold medal on a day that was Olympic in scope both for its shock value and its intrinsic weirdness .",0.895
"Cambodia passes succession law Cambodia approves a law to choose a new monarch, after King Sihanouk's abdication announcement.",0,World,Cambodia passes succession law Cambodia approves a law to choose a new monarch after King Sihanouk's abdication announcement .,0.9993
"Saints Revoke Waiver Claim on Derek Ross (AP) AP - One day after placing a waiver claim on troubled cornerback Derek Ross, the Saints did an about-face and released the former Ohio State standout after he missed a scheduled flight to New Orleans on Wednesday night.",1,Sports,"The Saints revoke waiver claim on Derek Ross (AP) AP - One day after placing a waiver on troubled cornerback Derek Ross, the Saints did an about-face and released the former Ohio State standout after he missed a scheduled flight to New Orleans on Wednesday night .",0.9962
Sharapova advances to Korea Open final Reigning Wimbledon champion Maria Sharapova has thrashed Anne Kremer of Luxembourg to advance to the final of the Korea Open in Seoul.,1,Sports,Sharapova advances to the Korea Open final Reigning Wimbledon champion Maria Sha Rapova has thrashed Anne Kremer of Luxembourg to advance to the final of Korea Open in Seoul .,0.9509
"Reclusive Amish could be thrown into election battleground (AFP) AFP - Martha Lapp hopes to vote for the first time in the US presidential election, in which the reclusive Amish sect that her family belongs to could play a key role.",0,World,"Reclusive Amish could be thrown into the election battleground (AFP) AFP - Martha Lapp hopes to vote for the first time in the US presidential election, in which the reclusive amish sect that her family belongs could play a key role .",0.9989
"Microsoft Opens Software Development Center in India (Update3) Microsoft Corp., the world #39;s largest software maker, will hire several hundred #39; #39; people in the next year at its development center in India, expanding its workforce of 800, Chief Executive Steve Ballmer said.",2,Business,"Microsoft opens a software development center in India (Update3) Microsoft Corp., the world#39;s largest software maker, will hire several hundred people at its development centre in India in the next year, expanding its workforce of 800, said Chief Executive Steve Ballmer .",0.9824
"Old Labor Tactics Resurface in New Union Labor experts say Unite Here, the newly merged union that is representing the DC hotel workers in their current contract dispute, is one of the most outspoken and toughest unions under the AFL-CIO umbrella.",2,Business,"Old Labor Tactics Resurface in the New Union Labor experts say that Unite Here, the newly merged union representing the DC hotel workers in their current contract dispute, is one of the most outspoken and toughest unions under the umbrella of the AFL-CIO .",0.9921
"UK Watchdog Turns Up Heat on Banks  LONDON (Reuters) - Britain's financial regulator will step  up scrutiny of investment banks' management of conflicts of  interest and risk in the wake of a number of high profile cases  such as WorldCom, Enron and Parmalat.",2,Business,"UK watchdog turns up heat on banks LONDON (Reuters) - In the wake of a number of high profile cases such as WorldCom, Enron and Parmalat, Britain's financial regulator will increase scrutiny of the management of conflicts of interest and risk by investment banks .",0.9797
"In the E.R., Learning to Love the PC The keyboard is mightier than the whiteboard at an emergency room in the Bronx, where the use of computers is now a staple.",3,Sci/Tech,"Learning to Love the PC in the E.R. The keyboard is stronger than the whiteboard in an emergency room in the Bronx, where the use of computers is now a staple .",0.9668
"Update 1: Thai Airways Orders 6 Airbus Superjumbos Thai Airways has agreed to buy six Airbus A380s, becoming the 13th airline to order the new  quot;superjumbo, quot; the European aircraft maker said Friday.",2,Business,"Update 1: Thai Airways orders 6 Airbus Superjumbos Thai Airways has agreed to buy six Airbus A380s, becoming the 13th airline to order the new quot; superjumbo quot , the European aircraft maker said Friday .",0.9989
Villeneuve and Sauber With Jacques Villeneuve testing for Renault today at Silverstone there has been the perhaps inevitable speculation that this could change things for next season when Giancarlo Fisichella is due to join Fernando Alonso at Renault F1.,1,Sports,Villeneuve and Sauber With Jacques Villeneuve testing for Renault today at Silverstone there has been the perhaps inevitable speculation that this could change things for the next season when Giancarlo Fisichella is due to join Fernando Alonso at Renault F1 .,0.9994
"Notes: Two-strike, two-out blues Chicago Cubs manager Dusty Baker talked to LaTroy Hawkins on Thursday, and said he #39;ll go to the right-hander again if the team is in a save situation.",1,Sports,"Notes: Two-strike, two-out blues Chicago Cubs manager Dusty Baker talked to LaTroy Hawkins on Thursday and said he would go to the right-hander again if the team is in a save situation .",0.9688
"New RIAA File-swapping Suits Target Students Fletcher writes  quot;The Recording Industry Association of America filed another round of lawsuits against alleged file-swappers, including students on 13 university campuses.",3,Sci/Tech,"New RIAA File-swapping suits target students Fletcher writes : quot;The Recording Industry Association of America filed another round of lawsuits against alleged File-Swappers, including students on 13 university campuses .",0.9928
"UPDATE 1-Beck to face Youzhny in St Petersburg final Unseeded Slovak Karol Beck reached the first final of his career at the St Petersburg Open, upsetting seventh-seeded Michael Llodra of France 6-4 2-6 6-1 on Saturday.",1,Sports,UPDATE 1-Beck to face Youzhny in the final of St. Petersburg Unseeded Slovak Karol Beck reached the first final of his career at the St Petersburg Open and defeated seventh seed Michael Llodra of France 6-4 2-6 6-1 on Saturday .,0.9831
"Morgan Stanley Profit Falls 34 Percent  NEW YORK (Reuters) - U.S. investment bank Morgan Stanley  &lt;A HREF=""http://www.investor.reuters.com/FullQuote.aspx?ticker=MWD.N target=/stocks/quickinfo/fullquote""&gt;MWD.N&lt;/A&gt; on Wednesday said quarterly profit dropped 34 percent  amid reduced trading revenue, falling well short of Wall  Street's already-lowered expectations after a summer of  sluggish market activity.",2,Business,"Morgan Stanley's profit falls 34 percent NEW YORK (Reuters) - U.S. investment bank Morgan Stanley &lt;A HREF=""http://www.investor.reuters.com/FullQuote.aspx?ticker=MWD.N target=/stocks/quickinfo/fullquote"" , said on Wednesday that its quarterly profit fell 34 percent amid reduced trading revenue, falling well short of Wall Street's already-lowered expectations after",0.974
"Trash Begins to Clutter Space Station (AP) AP - There's no space in the space station. With no garbage pickup by shuttles for nearly two years, the international space station is looking more and more like a cluttered attic.",3,Sci/Tech,Trash Begins to Clutter Space Station (AP) AP - There is no space in the space station - with no garbage pickup by shuttles for nearly two years - the international space station looks more and more like a cluttered attic .,0.9924
